{
  "schema_version": "1.0",
  "event_id": "MEM-20261012-192851-bfc437",
  "created_at": "2026-10-12T19:28:51+03:00",
  "scope": "council",
  "level": "L3_CANONICAL",
  "kind": "status",
  "subject": "memory.migration.legacy_chat_round1",
  "summary": "Legacy memory migration round 1 captures durable YouTube/Media strategy, RevenueSystem requirements, and Council architecture/governance context; exact historical five-channel concepts and detailed prior YouTube policy findings remain intentionally unresolved rather than guessed.",
  "details": {
    "migrated_domains": [
      "project/youtube",
      "project/media",
      "project/revenuesystem",
      "council"
    ],
    "excluded_sensitive_domains": [
      "health/private personal context"
    ],
    "remaining_recovery": [
      "exact historical five channel concepts",
      "exact prior YouTube policy/monetization findings",
      "any old artifacts not present in current repository or accessible chat context"
    ],
    "migration_rule": "requirements from chat are not execution evidence; repository remains source of truth"
  },
  "supersedes": [],
  "confidence": "verified",
  "sensitivity": "normal",
  "tags": [
    "memory",
    "migration",
    "legacy-chat",
    "round1"
  ],
  "source": {
    "type": "migration",
    "ref": "2026-10-12 canonical memory migration round 1"
  }
}
