{
  "schema_version": "1.0",
  "event_id": "MEM-20261012-194151-a5889b",
  "created_at": "2026-10-12T19:41:51+03:00",
  "scope": "council",
  "level": "L3_CANONICAL",
  "kind": "proposal",
  "subject": "council.history.specialist_expansion_2026_10_06",
  "summary": "A historical RevenueSystem Council arena recommended selective expansion with five specialist functions; this records design lineage only and does not override the current UniversalCouncil role configuration.",
  "details": {
    "recommended_specialists": [
      "Evidence & Decision Quality Specialist",
      "Reconciliation Controls Specialist",
      "Information Architecture Specialist",
      "Human Factors, Accessibility & Operational Ergonomics Specialist",
      "Compatibility & Contract Evolution Specialist"
    ],
    "rationale": "add only recurring non-duplicative gaps with explicit activation triggers and outputs",
    "anti_bureaucracy_rule": "role count may grow, but not every role participates in every decision",
    "reopen_trigger": "re-evaluate specialists if first 10 L/XL decisions show added latency without unique findings",
    "current_governance_override": false,
    "source_artifact": "RevenueSystem_Council_Specialist_Expansion_Arena_2026-10-06.md"
  },
  "supersedes": [],
  "confidence": "verified",
  "sensitivity": "normal",
  "tags": [
    "council",
    "history",
    "specialists",
    "restructure"
  ],
  "source": {
    "type": "migration",
    "ref": "Library: RevenueSystem_Council_Specialist_Expansion_Arena_2026-10-06(1).md"
  }
}
