{
  "schema_version": "1.0",
  "event_id": "MEM-20261012-192851-e7b13e",
  "created_at": "2026-10-12T19:28:51+03:00",
  "scope": "project/revenuesystem",
  "level": "L4_OWNER_DIRECTIVE",
  "kind": "decision",
  "subject": "revenuesystem.product_identity",
  "summary": "The desktop revenue application is named «المطابقة» and exists to replace/streamline the legacy daily revenue workflow.",
  "details": {
    "display_name": "المطابقة",
    "platform": "Windows desktop / WPF",
    "implementation_status": "verify current repository before claiming UI state"
  },
  "supersedes": [],
  "confidence": "owner_confirmed",
  "sensitivity": "normal",
  "tags": [
    "revenuesystem",
    "identity",
    "wpf"
  ],
  "source": {
    "type": "chat",
    "ref": "historical owner naming and product direction"
  }
}
