{
  "schema_version": "1.0",
  "event_id": "MEM-20261012-194151-7725bd",
  "created_at": "2026-10-12T19:41:51+03:00",
  "scope": "project/revenuesystem",
  "level": "L4_OWNER_DIRECTIVE",
  "kind": "requirement",
  "subject": "revenuesystem.deployment.contract",
  "summary": "A final setup executable is a release deliverable only after required updates are merged and hardening/tests pass; installation/database locations must be explicit and the production machine role must not be inferred from chat history alone.",
  "details": {
    "final_installer_required": true,
    "merge_before_release": true,
    "hardening_before_release": true,
    "tests_before_release": true,
    "installation_location_must_be_explicit": true,
    "database_location_must_be_explicit": true,
    "production_machine_identity": "must be verified at execution time",
    "implementation_status": "release requirement, not proof an installer is currently valid"
  },
  "supersedes": [],
  "confidence": "owner_confirmed",
  "sensitivity": "normal",
  "tags": [
    "revenuesystem",
    "deployment",
    "setup",
    "release"
  ],
  "source": {
    "type": "chat",
    "ref": "historical owner setup/deployment requirements"
  }
}
