{
  "schema_version": "1.0",
  "event_id": "MEM-20261012-203320-369b9c",
  "created_at": "2026-10-12T20:33:20+03:00",
  "scope": "project/youtube",
  "level": "L4_OWNER_DIRECTIVE",
  "kind": "requirement",
  "subject": "youtube.visual_system.current",
  "summary": "Channel visuals must stay close in visual grammar to the user-supplied reference video: Editorial Renaissance Motion with cobalt/sky-blue fields, paper/ivory space, classical and botanical cutouts, sparse editorial serif typography, illustrated diagrams and object-led transitions.",
  "details": {
    "internal_name": "Editorial Renaissance Motion",
    "palette": {
      "cobalt": "#174FA6",
      "clear_blue": "#2B73C9",
      "sky_blue": "#8EACD2",
      "paper_ivory": "#F6F1E8",
      "warm_parchment": "#D9C8B1",
      "deep_forest": "#173C32",
      "brass_gold": "#B58A3E",
      "charcoal": "#151515"
    },
    "composition": [
      "35–55% negative space on editorial frames",
      "one dominant visual hero per shot",
      "one headline plus at most one micro-caption",
      "alternate sparse editorial and full-visual frames",
      "diagrams feel printed/illustrated rather than SaaS/news UI"
    ],
    "motion": [
      "oversized object wipe",
      "masked object reveal",
      "illustration-photo-diagram match cut",
      "slow camera drift/parallax",
      "zoom through object",
      "line-drawing build",
      "editorial page/panel shift",
      "botanical/engraving reveal",
      "full cobalt breathing reset frame",
      "shape/color match cut"
    ],
    "reject": [
      "generic glitch packs",
      "constant kinetic typography",
      "random zoom presets",
      "filler AI cinematic B-roll",
      "news tickers",
      "unearned cyberpunk neon"
    ],
    "shot_taxonomy": [
      "EVIDENCE",
      "EXPLANATION",
      "ATMOSPHERE",
      "TRANSITION"
    ],
    "reference": "user-supplied video shown on computer screen",
    "governing_report": "docs/research/2026-10-12-broad-format-channel-reselection.md"
  },
  "supersedes": [],
  "confidence": "owner_confirmed",
  "sensitivity": "normal",
  "tags": [
    "youtube",
    "visual-system",
    "editorial",
    "renaissance",
    "motion",
    "reference-style"
  ],
  "source": {
    "type": "chat",
    "ref": "Owner requirement: theme, colors, direction, drawing and transitions close to reference video",
    "commit": "716b26f7333f8d796d841facd432a046aa7259f0"
  }
}
