{
  "schema_version": "1.0",
  "event_id": "MEM-20261012-194151-a78de1",
  "created_at": "2026-10-12T19:41:51+03:00",
  "scope": "council",
  "level": "L3_CANONICAL",
  "kind": "status",
  "subject": "memory.migration.legacy_artifacts_round3",
  "summary": "Legacy memory migration round 3 adds durable RevenueSystem owner requirements, a SHA-bounded historical audit baseline, and historical Council specialist-design lineage without promoting dated findings to current truth.",
  "details": {
    "migrated_domains": [
      "project/revenuesystem",
      "council"
    ],
    "safeguards": [
      "historical audit tied to exact SHA",
      "no old finding promoted to current defect",
      "current repository remains execution truth",
      "no sensitive personal/health data migrated"
    ],
    "source_artifacts": [
      "19_Comprehensive_Audit_Closure_Report(1).md",
      "RevenueSystem_Council_Specialist_Expansion_Arena_2026-10-06(1).md"
    ]
  },
  "supersedes": [],
  "confidence": "verified",
  "sensitivity": "normal",
  "tags": [
    "memory",
    "migration",
    "round3",
    "revenuesystem",
    "council"
  ],
  "source": {
    "type": "migration",
    "ref": "2026-10-12 legacy artifact migration round 3"
  }
}
