{
  "schema_version": "1.0",
  "event_id": "MEM-20261016-032421-8250cd",
  "created_at": "2026-10-16T03:24:21+03:00",
  "scope": "project/youtube",
  "level": "L4_OWNER_DIRECTIVE",
  "kind": "architecture",
  "subject": "youtube.channel_operating_system.current",
  "summary": "Channel Operating System v1.9 keeps W1 story-first and upgrades W2 into an 11-pass YouTube-native script system. W2 now requires Hook & Retention Map before the first full script, First-30-Second Gate, Anti-Article, Spoken-Language, Visual/Narrative, Open Loop, Cold Viewer, Independent Fact Check and Red Team Retention review before Script Lock. No interval may exceed 90 seconds without a fresh reason to continue; current long-form Script Lock requires at least eight minutes.",
  "details": {
    "channel_operating_system_version": "1.9",
    "master_pipeline_version": "1.3",
    "packaging_bible_version": "2",
    "youtube_script_bible_version": "1",
    "script_development_version": "2.0",
    "required_script_pass_count": 11,
    "required_script_passes": [
      "S0 Story Question",
      "S1 Research Pack",
      "S2 Story Architecture",
      "S3 Hook & Retention Map",
      "S4 First Script",
      "S5 YouTube Editorial Rewrite",
      "S6 Visual/Narrative Pass",
      "S7 Independent Fact Check",
      "S8 Voice/Narration Rewrite",
      "S9 Red Team Retention Review",
      "S10 Locked Script"
    ],
    "first_30_second_gate_required": true,
    "anti_article_test_required": true,
    "spoken_language_test_required": true,
    "visual_beat_map_required": true,
    "open_loop_map_required": true,
    "cold_viewer_test_required": true,
    "red_team_retention_review_required": true,
    "max_seconds_without_new_reason_to_continue": 90,
    "preferred_story_visual_change_seconds": "30-60",
    "minimum_long_form_runtime_seconds": 480,
    "script_title_must_match_owner_title_lock": true,
    "governing_config": "company/config/channel_operating_system.json",
    "governing_doc": "docs/operations/media/CHANNEL_OPERATING_SYSTEM.md",
    "script_bible": "docs/operations/media/YOUTUBE_SCRIPT_BIBLE.md",
    "master_pipeline_doc": "docs/operations/media/STUDIO_MASTER_PIPELINE.md"
  },
  "supersedes": [
    "MEM-20261016-025013-6e5a1f"
  ],
  "confidence": "owner_confirmed",
  "sensitivity": "normal",
  "tags": [
    "youtube",
    "studio",
    "W2",
    "script",
    "retention",
    "anti-article",
    "cold-viewer",
    "red-team"
  ],
  "source": {
    "type": "repository",
    "ref": "main",
    "commit": "596dcda338b0180ae2a40949f0d857da985768e2"
  }
}
