{
  "schema_version": "1.0",
  "event_id": "MEM-20261015-001500-lnv204",
  "created_at": "2026-10-15T00:03:08+03:00",
  "scope": "project/youtube",
  "level": "L4_OWNER_DIRECTIVE",
  "kind": "architecture",
  "subject": "youtube.channel_operating_system.current",
  "summary": "Channel Operating System v2.0 adopts five stages, three gates, one system pilot and bounded native editing; existing visual/reference and factual/rights safeguards remain.",
  "details": {
    "governing_doc": "docs/operations/media/LEAN_VIDEO_PRODUCTION_WORKFLOW.md",
    "governing_config": "company/config/channel_operating_system.json",
    "legacy_status": "SUPERSEDED_CANCELLED",
    "pilot_status": "NOT_RUN",
    "no_main_merge": true,
    "public_publish_authorized": false,
    "timing_targets_unmeasured": true,
    "scope_override": "Native media craft routing replaces GUI-first for this workflow only.",
    "priority": "Current workflow overrides older media pilot/tool/production-cell procedure; historical evidence is retained."
  },
  "supersedes": [
    "MEM-20261013-015645-fbd625"
  ],
  "confidence": "owner_confirmed",
  "sensitivity": "normal",
  "tags": [
    "media",
    "lean-workflow",
    "cancellation",
    "three-gates",
    "pr30-only"
  ],
  "source": {
    "type": "chat",
    "ref": "https://github.com/yassenjabal-jpg/UniversalCouncil/pull/30"
  }
}
